<?xml version="1.0" encoding="UTF-8"?>
<dataroot xmlns:od="urn:schemas-microsoft-com:officedata" xmlns:xsi="http://www.w3.org/2001/XMLSchema-instance"  xsi:noNamespaceSchemaLocation="users.xsd" generated="2010-12-02T21:08:42">
<users>
<username>a</username>
<password>a</password>
<name>admin</name>
<gender>admin</gender>
<email>admin@fool.com</email>
</users>
<users>
<username>cool</username>
<password>2</password>
<name>raj</name>
<gender>m</gender>
<email>raj@yahoo.com</email>
</users>
<users>
<username>don</username>
<password>w</password>
<name>Kumar</name>
<gender>m</gender>
<email>djj@jj.coom</email>
</users>
<users>
<username>q</username>
<password>1</password>
<name>deepak</name>
<gender>male</gender>
<email>deepak@just.in</email>
</users>
<users>
<username>q2</username>
<password>2</password>
<name></name>
<gender>m</gender>
<email></email>
</users>
<users>
<username>w</username>
<password>2</password>
<name>modak</name>
<gender>male</gender>
</users>
<users>
<username>root2</username>
<password>wewe</password>
<name></name>
<gender>m</gender>
<email></email>
</users>
<users>
<username>admin</username>
<password>admin</password>
<name>Sajid</name>
<gender>male</gender>
<email>obs@gmail.com</email>
</users>
</dataroot>
